course,date,off_time,race_name,distance_f,region,race_class,type,age_band,rating_band,prize,field_size,going,surface,jumps,big_race,is_abandoned,tip,verdict,betting_forecast,horse,horse_id,age,sex,colour,region_runner,breeder,dam,sire,damsire,trainer,owner,number,draw,lbs,comment,spotlight,ofr,rpr,ts,jockey,silk_url,last_run,form,trainer_rtf,trainer_location,trainer_14_runs,trainer_14_wins,trainer_14_percent,,,ORI,Best,Skybet,William Hill,Coral,Betfred,Boyle Sports,Ladbrokes,Betfair Exchange,RESULT,SP odd,BFOri,Jockey STAT,Race count,JOCKEY RACES,,,,,,,,,,,Trainer STAT,Race count,TRAINER RACES,,,,,,
Sedgefield,11/6/2025,12:45,Canine Premier Flex Plus Joint Supplement Maiden Hurdle (GBB Race),17,GB,Class 4,Hurdle,4yo+,,"£4,193",5,Good,Turf,8 hurdles,FALSE,FALSE,,,"Evs Swingingonthesteel, 3/1 Westernesse, 9/2 Noble George, 8/1 Avalon Beach, 16/1 Yanka Blue, 25/1 Born Like Me",Swingingonthesteel,hrs_39431406,5,gelding,b,GB,P G Nicholas,Patsola,Linda's Lad,Robellino,Rebecca Menzies,Old Gold Racing 24,4,0,158,Two-time bumper winner (including here) who brings potential to this first hurdle start,"Soft-ground point-to-point bumper winner who won a Musselburgh bumper (1m7f, good to soft) last November on his second rules start and followed up here (2m1f, good) in April; brings potential to this first hurdle start and could play a leading role.",-,-,-,Nathan Moscrop,https://www.rp-assets.com/svg/1/1/5/350511.svg,209,1/211-,48,"Morden, Durham",21,1,5,N/A,,1.3,1.4,,1.4,1.36,1.36,1.36,1.36,1.41,,,1.35,,,,,,,,,,,,,,,,,,,,,,
Sedgefield,11/6/2025,12:45,Canine Premier Flex Plus Joint Supplement Maiden Hurdle (GBB Race),17,GB,Class 4,Hurdle,4yo+,,"£4,193",5,Good,Turf,8 hurdles,FALSE,FALSE,,,"Evs Swingingonthesteel, 3/1 Westernesse, 9/2 Noble George, 8/1 Avalon Beach, 16/1 Yanka Blue, 25/1 Born Like Me",Westernesse,hrs_27140050,6,gelding,b,IRE,Maurice Regan,Truthwillsetufree,Camelot,Dalakhani,Donald McCain,Mrs Sian McCain,NR,0,158,Three-time Flat winner; 22l 3rd on hurdle debut but that was a warm maiden at Market Rasen,"Three-time Flat winner, the latest in June; beaten 22l when third of seven on hurdle debut at Market Rasen (2m, good) last month but that was a warm maiden and he's high on the list in today's company.",-,109,87,NON-RUNNER,https://www.rp-assets.com/svg/1/3/5/234531.svg,23,3,36,"Cholmondeley, Cheshire",14,0,0,N/A,,,,,,,,,,,,,,,,,,,,,,,,,,,,,,,,,,,
Sedgefield,11/6/2025,12:45,Canine Premier Flex Plus Joint Supplement Maiden Hurdle (GBB Race),17,GB,Class 4,Hurdle,4yo+,,"£4,193",5,Good,Turf,8 hurdles,FALSE,FALSE,,,"Evs Swingingonthesteel, 3/1 Westernesse, 9/2 Noble George, 8/1 Avalon Beach, 16/1 Yanka Blue, 25/1 Born Like Me",Yanka Blue,hrs_53359033,4,filly,b,IRE,Oldcourt Stud,Bee Yanka,Blue Bresil,Shirocco,Alison Thorpe,L H Evans,6,0,151,Not devoid of ability but she's yet to threaten and others are preferred,"Not devoid of ability but she's yet to threaten, most recently off a modest mark on her handicap debut at Fontwell; others are preferred.",89,103,81,Derek Fox,https://www.rp-assets.com/svg/7/5/5/218557.svg,14,685345,50,"Caerfyrddin, Carmarthens",4,0,0,N/A,,11,17,,15,17,13,15,17,25,,,10,,,,,,,,,,,,,,,,,,,,,,
Sedgefield,11/6/2025,13:20,Michael Watson Civils & Groundworks Handicap Chase,21,GB,Class 5,Chase,4yo+,0-100,"£3,248",11,Good,Turf,15 fences,FALSE,FALSE,,,"7/4 Prized Jet, 6/1 Largy Train, 13/2 Imperial Rule,  Get A Superstar, 15/2 Beat The Edge, 9/1 Kings Justice, 11/1 Pure Surf, 14/1 Diamond Trilogy, 20/1 Community Rebel, 33/1 Earlofbrackenstown, 50/1 El Muchacho",Imperial Rule,hrs_33275291,8,gelding,b,IRE,Adrian Sutton,Our Ned,Imperial Monarch,Bob Back,Lizzie Quinlan,"Mrs K Elliott, Mrs D Chapman & Partner",1,0,168,Returns from absence but 3-6 in chases and could still have more to offer; stable debut,"Two wins for Rebecca Menzies last November (2m3f, good; including here) and third of six over C&D (soft) the following month; absent since but 3-6 in chases and could still have more to offer; respected on stable debut.",98,101,83,Sean Quinlan,https://www.rp-assets.com/svg/2/6/2/364262.svg,335,05113-,29,"Bolton Mill, Cumbria",7,0,0,N/A,,6,34,,34,29,34,34,29,50,,,9.6,,,,,,,,,,,,,,,,,,,,,,
Sedgefield,11/6/2025,13:20,Michael Watson Civils & Groundworks Handicap Chase,21,GB,Class 5,Chase,4yo+,0-100,"£3,248",11,Good,Turf,15 fences,FALSE,FALSE,,,"7/4 Prized Jet, 6/1 Largy Train, 13/2 Imperial Rule,  Get A Superstar, 15/2 Beat The Edge, 9/1 Kings Justice, 11/1 Pure Surf, 14/1 Diamond Trilogy, 20/1 Community Rebel, 33/1 Earlofbrackenstown, 50/1 El Muchacho",Prized Jet,hrs_51831437,5,mare,b,IRE,Gavin Howlett,Keeping The Dream,Jet Away,Arcadio,Jennie Candlish,Youlneverdrinkalone,2,0,168,Clear when falling four out here last month; may well make amends off the same mark,"Unseated on chase debut at Tramore last month and fell four out here ten days later (2m5f, good); however, she was a long way clear and looked as though she would take plenty of catching; granted a clear round she may well make amends off the same mark; has left Shark Hanlon since last time.",98,-,-,Paddy Hanlon(5),https://www.rp-assets.com/svg/1/2/7/349721.svg,18,-438UF,50,"Basford, Staffs",20,0,0,N/A,,3,4,,3.75,4,4,3.75,4,4.3,,,3.5,,,,,,,,,,,,,,,,,,,,,,
Sedgefield,11/6/2025,13:20,Michael Watson Civils & Groundworks Handicap Chase,21,GB,Class 5,Chase,4yo+,0-100,"£3,248",11,Good,Turf,15 fences,FALSE,FALSE,,,"7/4 Prized Jet, 6/1 Largy Train, 13/2 Imperial Rule,  Get A Superstar, 15/2 Beat The Edge, 9/1 Kings Justice, 11/1 Pure Surf, 14/1 Diamond Trilogy, 20/1 Community Rebel, 33/1 Earlofbrackenstown, 50/1 El Muchacho",Largy Train,hrs_24687677,8,gelding,b,GB,Mickley Stud,Snow Train,Yorgunnabelucky,Rail Link,Henry Hogarth,Hogarth Racing,3,0,167,"Ran just once last season, when stretched by 3m2f; this C&D winner could go well","Ran just once last season, when well beaten at Carlisle (3m2f, soft) last December, and returns from some more time off today; however, he ran well for a fair way at Carlisle and won three in a row over 2m5f/2m4f (soft/heavy) in early 2024, including over C&D; interesting back down in trip.",97,103,60,Danny McMenamin,https://www.rp-assets.com/svg/2/1/0/59012.svg,326,115/4-,,"Stillington, N Yorks",0,0,None,N/A,,7.5,8,,8,7.5,8,8,7.5,9.4,,,8,,,,,,,,,,,,,,,,,,,,,,
Sedgefield,11/6/2025,13:20,Michael Watson Civils & Groundworks Handicap Chase,21,GB,Class 5,Chase,4yo+,0-100,"£3,248",11,Good,Turf,15 fences,FALSE,FALSE,,,"7/4 Prized Jet, 6/1 Largy Train, 13/2 Imperial Rule,  Get A Superstar, 15/2 Beat The Edge, 9/1 Kings Justice, 11/1 Pure Surf, 14/1 Diamond Trilogy, 20/1 Community Rebel, 33/1 Earlofbrackenstown, 50/1 El Muchacho",El Muchacho,hrs_29226393,8,gelding,gr,IRE,Mrs Dale Adams,La Segnora,Walk In The Park,Turgeon,Mike Sowersby,T J Stubbins and M E Sowersby,4,0,161,Continues to drop down the weights but he's struggled for form of late,"Ran okay on a couple of occasions in the spring and continues to drop down the weights, but he's struggled for form more recently.",91,101,97,Aaron Anderson(5),https://www.rp-assets.com/svg/6/8/9/302986.svg,23,3P7080,50,"Little Barugh, N Yorks",6,0,0,N/A,,23,41,,41,41,41,41,41,60,,,11,,,,,,,,,,,,,,,,,,,,,,
Sedgefield,11/6/2025,13:20,Michael Watson Civils & Groundworks Handicap Chase,21,GB,Class 5,Chase,4yo+,0-100,"£3,248",11,Good,Turf,15 fences,FALSE,FALSE,,,"7/4 Prized Jet, 6/1 Largy Train, 13/2 Imperial Rule,  Get A Superstar, 15/2 Beat The Edge, 9/1 Kings Justice, 11/1 Pure Surf, 14/1 Diamond Trilogy, 20/1 Community Rebel, 33/1 Earlofbrackenstown, 50/1 El Muchacho",Get A Superstar,hrs_33975088,7,gelding,b,IRE,Luke O'Reilly,Glenariff,Getaway,Kayf Tara,Dr Richard Newland & Jamie Insole,J H Graham,5,0,160,Makes reappearance and can be in the mix if tapping back into his chase debut promise,"Jumped to the right throughout when well beaten at Catterick (2m3f, good to soft) in January, and he's at another left-handed track for this first run since; however, two starts ago he was third on chase debut at Catterick (2m3f, good) and can be in the mix if tapping back into that promise.",90,104,95,Luke Scott(3),https://www.rp-assets.com/svg/9/7/0/309079.svg,288,44535-,39,"Elmbridge, Worcs",29,1,3,N/A,,6.5,5.5,,5.5,5.5,5.5,5.5,5.5,5.9,,,7.2,,,,,,,,,,,,,,,,,,,,,,
Sedgefield,11/6/2025,13:20,Michael Watson Civils & Groundworks Handicap Chase,21,GB,Class 5,Chase,4yo+,0-100,"£3,248",11,Good,Turf,15 fences,FALSE,FALSE,,,"7/4 Prized Jet, 6/1 Largy Train, 13/2 Imperial Rule,  Get A Superstar, 15/2 Beat The Edge, 9/1 Kings Justice, 11/1 Pure Surf, 14/1 Diamond Trilogy, 20/1 Community Rebel, 33/1 Earlofbrackenstown, 50/1 El Muchacho",Community Rebel,hrs_29522997,9,gelding,b,IRE,James O'Donovan,Cnocbui Cailin,Asian Heights,Moscow Society,Micky Hammond,Aleem Kanji,6,0,159,Runner-up in the spring in two of his first three chases but went off the boil in summer,Runner-up in the spring in two of his first three chases but went off the boil in the summer and a return to form is needed after a break.,89,106,34,Jamie Hamilton,https://www.rp-assets.com/svg/2/7/4/266472.svg,130,P-2P58,53,"Middleham, N Yorks",17,2,12,N/A,,21,34,,34,29,34,34,29,50,,,16,,,,,,,,,,,,,,,,,,,,,,
Sedgefield,11/6/2025,13:20,Michael Watson Civils & Groundworks Handicap Chase,21,GB,Class 5,Chase,4yo+,0-100,"£3,248",11,Good,Turf,15 fences,FALSE,FALSE,,,"7/4 Prized Jet, 6/1 Largy Train, 13/2 Imperial Rule,  Get A Superstar, 15/2 Beat The Edge, 9/1 Kings Justice, 11/1 Pure Surf, 14/1 Diamond Trilogy, 20/1 Community Rebel, 33/1 Earlofbrackenstown, 50/1 El Muchacho",Beat The Edge,hrs_27877129,8,gelding,b,IRE,Ms M Kavanagh,Darsi O'Grady,Beat Hollow,Darsi,Micky Hammond,Smartwater Utilities,7,0,155,Hard to win with but often runs well and every chance he'll be bang there,Has his quirks and he's won just two of his 33 chase starts but he often runs well and may have needed last month's comeback run; every chance he'll be bang there; cheekpieces return (no positive impact previously).,85,108,96,Brian Hughes,https://www.rp-assets.com/svg/1/0/9/302901.svg,18,32-323,53,"Middleham, N Yorks",17,2,12,N/A,,6,6,,5.5,5.5,6,5.5,5.5,6.4,,,4.6,,,,,,,,,,,,,,,,,,,,,,
Sedgefield,11/6/2025,13:20,Michael Watson Civils & Groundworks Handicap Chase,21,GB,Class 5,Chase,4yo+,0-100,"£3,248",11,Good,Turf,15 fences,FALSE,FALSE,,,"7/4 Prized Jet, 6/1 Largy Train, 13/2 Imperial Rule,  Get A Superstar, 15/2 Beat The Edge, 9/1 Kings Justice, 11/1 Pure Surf, 14/1 Diamond Trilogy, 20/1 Community Rebel, 33/1 Earlofbrackenstown, 50/1 El Muchacho",Diamond Trilogy,hrs_37095940,6,gelding,br,IRE,Denis Cusack,For A While,Diamond Boy,Presenting,Dianne Sayer,G Critchley,8,0,153,Has achieved little thus far but he's a possible improver on today's chase/handicap debut,"Achieved little in a bumper and his three novice hurdles; however, connections waste little time in sending this 6yo over fences for his handicap debut, and his useful half-brother Whistle Stop Tour improved for going chasing; on a lowly opening mark and he's one to watch in the betting.",83,-,-,Peter Kavanagh,https://www.rp-assets.com/svg/4/4/9/316944.svg,26,7-608,100,"Hackthorpe, Cumbria",3,0,0,N/A,,9,23,,23,23,23,23,23,27,,,14.5,,,,,,,,,,,,,,,,,,,,,,
Sedgefield,11/6/2025,13:20,Michael Watson Civils & Groundworks Handicap Chase,21,GB,Class 5,Chase,4yo+,0-100,"£3,248",11,Good,Turf,15 fences,FALSE,FALSE,,,"7/4 Prized Jet, 6/1 Largy Train, 13/2 Imperial Rule,  Get A Superstar, 15/2 Beat The Edge, 9/1 Kings Justice, 11/1 Pure Surf, 14/1 Diamond Trilogy, 20/1 Community Rebel, 33/1 Earlofbrackenstown, 50/1 El Muchacho",Pure Surf,hrs_23254427,9,mare,ch,IRE,Mrs Breda Ryan,Eventide,Frammassone,Where Or When,Victor Thompson,V Thompson,9,0,150,Below par when last seen but ran well last November following a break and is not ruled out,Below par on final two runs in the spring but she ran well last November when back from a break and is 1lb lower than when going close here in April under Pippa Brown; not ruled out.,80,104,77,Miss Pippa Brown(7),https://www.rp-assets.com/svg/8/6/4/468.svg,187,5125-P,,"Alnwick, Northumbria",0,0,None,N/A,,29,34,,29,29,34,34,29,50,,,12,,,,,,,,,,,,,,,,,,,,,,
Sedgefield,11/6/2025,13:20,Michael Watson Civils & Groundworks Handicap Chase,21,GB,Class 5,Chase,4yo+,0-100,"£3,248",11,Good,Turf,15 fences,FALSE,FALSE,,,"7/4 Prized Jet, 6/1 Largy Train, 13/2 Imperial Rule,  Get A Superstar, 15/2 Beat The Edge, 9/1 Kings Justice, 11/1 Pure Surf, 14/1 Diamond Trilogy, 20/1 Community Rebel, 33/1 Earlofbrackenstown, 50/1 El Muchacho",Kings Justice,hrs_29295378,7,gelding,b,GB,S Allwood &  D Bostock,Queen's Law,Pether's Moon,Midnight Legend,Sam Allwood,Mrs Beverley Bostock,10,0,150,Tailed off when last seen but wind op since and he's dropped to a dangerous mark,"Tailed off at Uttoxeter in May when last seen but he returns having had wind surgery and he's 5lb lower than when competing over C&D in March, when he was in contention when falling two out; could have a say.",80,100,86,Toby Wynne,https://www.rp-assets.com/svg/6/4/3/259346.svg,173,25F4-5,,"Whitchurch, Shropshire",4,0,0,N/A,,19,15,,15,15,15,15,15,20,,,10.5,,,,,,,,,,,,,,,,,,,,,,
Sedgefield,11/6/2025,13:20,Michael Watson Civils & Groundworks Handicap Chase,21,GB,Class 5,Chase,4yo+,0-100,"£3,248",11,Good,Turf,15 fences,FALSE,FALSE,,,"7/4 Prized Jet, 6/1 Largy Train, 13/2 Imperial Rule,  Get A Superstar, 15/2 Beat The Edge, 9/1 Kings Justice, 11/1 Pure Surf, 14/1 Diamond Trilogy, 20/1 Community Rebel, 33/1 Earlofbrackenstown, 50/1 El Muchacho",Earlofbrackenstown,hrs_37890720,6,gelding,ch,IRE,Miss Michelle Bolger,Eva's Legacy,Mount Nelson,King's Theatre,Philip Kirby,P Kirby,11,0,149,One to watch in the betting on chase debut but hard to fancy on hurdle form,Lightly raced 6yo who is one to watch in the betting on his chase debut but he was 0-9 over hurdles and never finished better than fifth; his claims aren't compelling.,79,-,-,Conor Rabbitt(5),https://www.rp-assets.com/svg/6/6/8/46866.svg,21,0/5PP0,26,"East Appleton, N Yorks",19,0,0,N/A,,17,4.5,,4.5,4.33,4.5,4.5,4.33,5,,,11,,,,,,,,,,,,,,,,,,,,,,
Sedgefield,11/6/2025,13:55,Fairlight Studio Returns From Canada Novices' Hurdle (GBB Race),20,GB,Class 4,Hurdle,4yo+,,"£4,193",6,Good,Turf,10 hurdles,FALSE,FALSE,,,"2/5 Absolutely Doyen, 7/2 Lowlands, 11/2 The Hawkstonian, 33/1 Captain Ted, 66/1 Fran The Man, 100/1 Top Of The Stars",Absolutely Doyen,hrs_39568536,5,gelding,b,IRE,Mrs Kathleen Duff,Duffys Present,Doyen,Presenting,Paul Nicholls,Ian Moore,1,0,163,,,113,120,96,Freddie Keighley(7),https://www.rp-assets.com/svg/4/5/5/354554.svg,19,2242-1,61,"Ditcheat, Somerset",31,6,19,N/A,,1.5,1.22,,1.22,1.22,1.22,1.22,1.22,1.26,,,1.43,,,,,,,,,,,,,,,,,,,,,,
Sedgefield,11/6/2025,13:55,Fairlight Studio Returns From Canada Novices' Hurdle (GBB Race),20,GB,Class 4,Hurdle,4yo+,,"£4,193",6,Good,Turf,10 hurdles,FALSE,FALSE,,,"2/5 Absolutely Doyen, 7/2 Lowlands, 11/2 The Hawkstonian, 33/1 Captain Ted, 66/1 Fran The Man, 100/1 Top Of The Stars",The Hawkstonian,hrs_46602892,5,gelding,gr,IRE,Tom Radley,Wicked Maria,Jukebox Jury,Daylami,Ben Pauling,Hawkstone Racing 1,2,0,156,No impact in bumpers but tackles new trip on hurdle debut with trainer in fine form,Unable to make an impact in his three bumpers but showed some ability and he tackles a new trip on this hurdle/seasonal debut with his trainer in fine form; possible improver.,-,-,-,Beau Morgan(5),https://www.rp-assets.com/svg/9/2/0/351029.svg,251,672-,59,"Naunton, Gloucs",29,9,31,N/A,,7,12,,11,11,12,11,11,16,,,7,,,,,,,,,,,,,,,,,,,,,,
Sedgefield,11/6/2025,13:55,Fairlight Studio Returns From Canada Novices' Hurdle (GBB Race),20,GB,Class 4,Hurdle,4yo+,,"£4,193",6,Good,Turf,10 hurdles,FALSE,FALSE,,,"2/5 Absolutely Doyen, 7/2 Lowlands, 11/2 The Hawkstonian, 33/1 Captain Ted, 66/1 Fran The Man, 100/1 Top Of The Stars",Top Of The Stars,hrs_56188874,7,gelding,ch,GB,Miss Doreen M M Calder,Italstar,Eagle Top,Galileo,Simon Waugh,Miss D M M Calder,3,0,156,Triple-figure odds when well beaten in novice hurdles at Kelso this autumn on first 2 runs,"Triple-figure odds when well beaten in novice hurdles at Kelso this autumn on his first two starts (2m5f, good); transformation needed.",-,83,35,Ryan Mania,https://www.rp-assets.com/svg/2/1/7/9712.svg,32,58,,"Molesden, Northumberland",0,0,None,N/A,,81,201,,126,101,201,151,101,320,,,26,,,,,,,,,,,,,,,,,,,,,,
Sedgefield,11/6/2025,13:55,Fairlight Studio Returns From Canada Novices' Hurdle (GBB Race),20,GB,Class 4,Hurdle,4yo+,,"£4,193",6,Good,Turf,10 hurdles,FALSE,FALSE,,,"2/5 Absolutely Doyen, 7/2 Lowlands, 11/2 The Hawkstonian, 33/1 Captain Ted, 66/1 Fran The Man, 100/1 Top Of The Stars",Captain Ted,hrs_52709293,4,gelding,b,IRE,Brian O'Driscoll,Decheekymonkey,Leading Light,Presenting,Chris Grant,D&D Armstrong Ltd,4,0,155,Point runner-up but soundly beaten at big odds on first two hurdle starts,Went close in a point in May but soundly beaten at big odds on first two hurdle starts and will be of greater interest in handicaps after this.,-,101,99,Ross Chapman,https://www.rp-assets.com/svg/4/4/8/215844.svg,18,7283,50,"Billingham, Cleveland",4,0,0,N/A,,21,,,,,,,,,,,12,,,,,,,,,,,,,,,,,,,,,,
Sedgefield,11/6/2025,13:55,Fairlight Studio Returns From Canada Novices' Hurdle (GBB Race),20,GB,Class 4,Hurdle,4yo+,,"£4,193",6,Good,Turf,10 hurdles,FALSE,FALSE,,,"2/5 Absolutely Doyen, 7/2 Lowlands, 11/2 The Hawkstonian, 33/1 Captain Ted, 66/1 Fran The Man, 100/1 Top Of The Stars",Fran The Man,hrs_45856090,4,gelding,b,GB,Saeed Nasser Al Romaithi,Darrfonah,Postponed,Singspiel,Hannah McMahon,Miss H M McMahon,5,0,155,Promising third on debut in bumper last October but well beaten on his five outings since,"Promising third on debut in Huntingdon bumper last October but well beaten on his five outings since, the last three over hurdles.",85,95,72,Edward Austin(5),https://www.rp-assets.com/svg/d/0/7/253070d.svg,32,70-688,,"Cousland, W Lothian",0,0,None,N/A,,41,126,,101,101,126,101,101,200,,,12,,,,,,,,,,,,,,,,,,,,,,
Sedgefield,11/6/2025,13:55,Fairlight Studio Returns From Canada Novices' Hurdle (GBB Race),20,GB,Class 4,Hurdle,4yo+,,"£4,193",6,Good,Turf,10 hurdles,FALSE,FALSE,,,"2/5 Absolutely Doyen, 7/2 Lowlands, 11/2 The Hawkstonian, 33/1 Captain Ted, 66/1 Fran The Man, 100/1 Top Of The Stars",Lowlands,hrs_43508486,6,mare,b,IRE,Patrick F Callinan,Broadway Boulevard,Court Cave,Kris Kin,Nicky Richards,Greystoke Owners,6,0,149,4th on hurdle debut at Perth in September following an absence and she could improve again,"Built upon the promise shown in good-ground bumpers in 2024 when upped in trip and fourth of seven on hurdle debut at Perth (2m4f, good) in September, following an absence; that latest form reads pretty well and she may well improve again this afternoon.",-,116,75,Danny McMenamin,https://www.rp-assets.com/svg/6/1/4/309416.svg,42,459-4,82,"Greystoke, Cumbria",11,3,27,N/A,,3.25,5,,4.5,5,5,4.5,5,6.8,,,5.1,,,,,,,,,,,,,,,,,,,,,,
Sedgefield,11/6/2025,14:30,Michael & Olivia Watson Novices' Handicap Chase (Go North Forgive 'n Forget Series Qual') (GBB),19.5,GB,Class 4,Chase,4yo+,0-110,"£4,700",9,Good,Turf,14 fences,FALSE,FALSE,,,"5/2 Fierce Warrior, 11/2 Groovy Blue,  Born In The West, 13/2 Whatyouwaitingfor, 15/2 Just Gino,  Eagles Gold, 8/1 Fat Harry, 14/1 Scots Poet, 16/1 Paramaribo",Fierce Warrior,hrs_34961402,6,gelding,b/br,IRE,Ballyhampshire Stud Ltd,Kris Kindle,Sholokhov,Kris Kin,Nicky Henderson,Middleham Park Racing LXXV,1,0,169,Back in trip minus headgear for chase debut; top trainer reports he has schooled very well,"Stayed on well to win a competitive handicap hurdle at Musselburgh (3m, good to soft) in March in first-time cheekpieces; drops back in trip minus headgear for this chase debut but his top trainer reports he has schooled very well and this 6yo is open to further improvement.",111,-,-,Brian Hughes,https://www.rp-assets.com/svg/3/3/6/215633.svg,230,73021-,43,"Upper Lambourn, Berks",15,2,13,N/A,,6,4.33,,4.33,4.33,4,4,4.33,4.5,,,4.9,,,,,,,,,,,,,,,,,,,,,,
Sedgefield,11/6/2025,14:30,Michael & Olivia Watson Novices' Handicap Chase (Go North Forgive 'n Forget Series Qual') (GBB),19.5,GB,Class 4,Chase,4yo+,0-110,"£4,700",9,Good,Turf,14 fences,FALSE,FALSE,,,"5/2 Fierce Warrior, 11/2 Groovy Blue,  Born In The West, 13/2 Whatyouwaitingfor, 15/2 Just Gino,  Eagles Gold, 8/1 Fat Harry, 14/1 Scots Poet, 16/1 Paramaribo",Groovy Blue,hrs_37933630,6,gelding,b,GB,Richard Egan,Miss Izzy,Blue Bresil,Old Vic,Ben Pauling,Dan Donoghue & Hilary Pridham,2,0,166,Lightly raced 6yo who makes his chase debut with his trainer firmly among the winners,"Bumper (good to soft) and maiden hurdle (2m4f, good) who ran okay when fifth of 14 on his handicap hurdle debut at Worcester (2m4f, good) in May; makes his chase debut with his trainer firmly among the winners and this lightly raced 6yo could have more to offer.",108,-,-,Sean Quinlan,https://www.rp-assets.com/svg/3/6/4/344463.svg,184,6P31-5,59,"Naunton, Gloucs",29,9,31,N/A,,5,7,,7,7,7,7,7,7.8,,,6.2,,,,,,,,,,,,,,,,,,,,,,
Sedgefield,11/6/2025,14:30,Michael & Olivia Watson Novices' Handicap Chase (Go North Forgive 'n Forget Series Qual') (GBB),19.5,GB,Class 4,Chase,4yo+,0-110,"£4,700",9,Good,Turf,14 fences,FALSE,FALSE,,,"5/2 Fierce Warrior, 11/2 Groovy Blue,  Born In The West, 13/2 Whatyouwaitingfor, 15/2 Just Gino,  Eagles Gold, 8/1 Fat Harry, 14/1 Scots Poet, 16/1 Paramaribo",Born In The West,hrs_37790144,6,gelding,gr,IRE,Liam Walsh,Lucinda Grey,Westerner,Luso,Sam England,Mrs Angela Mary Leggett,3,0,162,Progressive in handicap hurdles last term and this point winner could improve now chasing,"Sent into handicap hurdles in February and was steadily progressive, winning at Catterick (2m3f, good) in March; shaped as though he would improve for his reappearance run at Carlisle three weeks ago and this point winner is a possible improver now chasing; respected.",104,-,-,Jonathan England,https://www.rp-assets.com/svg/1/2/9/89921.svg,21,2123-7,64,"Guiseley, W Yorks",11,3,27,N/A,,7,3,,3,2.88,3,2.88,2.88,3.6,,,6.8,,,,,,,,,,,,,,,,,,,,,,
Sedgefield,11/6/2025,14:30,Michael & Olivia Watson Novices' Handicap Chase (Go North Forgive 'n Forget Series Qual') (GBB),19.5,GB,Class 4,Chase,4yo+,0-110,"£4,700",9,Good,Turf,14 fences,FALSE,FALSE,,,"5/2 Fierce Warrior, 11/2 Groovy Blue,  Born In The West, 13/2 Whatyouwaitingfor, 15/2 Just Gino,  Eagles Gold, 8/1 Fat Harry, 14/1 Scots Poet, 16/1 Paramaribo",Whatyouwaitingfor,hrs_46046014,4,gelding,b,IRE,Martin Edmonds,Miss Philippa,Axxos,Mahler,Charlie Longsdon,Gerald's Charity Syndicate,4,0,157,Has changed stables and receives handy 4yo allowance on chase/handicap debut,"Consistent 4yo who won a maiden hurdle at Newton Abbot (2m2f, good) in August; sold out of the Twiston-Davies yard for £24,000 last month and he receives a handy age allowance on this chase and handicap debut; could have a part to play.",108,-,-,David Bass,https://www.rp-assets.com/svg/4/8/2/357284.svg,24,322212,36,"Chipping Norton, Oxfordshire",13,1,8,N/A,,4.5,,,,,,,,,,,5,,,,,,,,,,,,,,,,,,,,,,
Sedgefield,11/6/2025,14:30,Michael & Olivia Watson Novices' Handicap Chase (Go North Forgive 'n Forget Series Qual') (GBB),19.5,GB,Class 4,Chase,4yo+,0-110,"£4,700",9,Good,Turf,14 fences,FALSE,FALSE,,,"5/2 Fierce Warrior, 11/2 Groovy Blue,  Born In The West, 13/2 Whatyouwaitingfor, 15/2 Just Gino,  Eagles Gold, 8/1 Fat Harry, 14/1 Scots Poet, 16/1 Paramaribo",Scots Poet,hrs_24277260,9,gelding,b,GB,Distillery Stud,Blue Nymph,Yeats,Selkirk,Ewan Whillans,Distillery Racing Club,5,0,155,Has competitive mark on best chase form but 0-5 over fences; others have greater potential,Four-time hurdle winner; on a competitive mark on best chase form but 0-5 in this discipline and others have greater potential than this 9yo.,97,115,90,Conor O'Farrell,https://www.rp-assets.com/svg/2/9/7/161792.svg,29,3-25F3,36,"Hawick, Scottish Borders",11,0,0,N/A,,9,21,,21,21,19,17,21,24,,,9.6,,,,,,,,,,,,,,,,,,,,,,
Sedgefield,11/6/2025,14:30,Michael & Olivia Watson Novices' Handicap Chase (Go North Forgive 'n Forget Series Qual') (GBB),19.5,GB,Class 4,Chase,4yo+,0-110,"£4,700",9,Good,Turf,14 fences,FALSE,FALSE,,,"5/2 Fierce Warrior, 11/2 Groovy Blue,  Born In The West, 13/2 Whatyouwaitingfor, 15/2 Just Gino,  Eagles Gold, 8/1 Fat Harry, 14/1 Scots Poet, 16/1 Paramaribo",Just Gino,hrs_34665225,6,gelding,ch,FR,S Berger &  J M Prost Alamartine,Distillee,It's Gino,Alberto Giacometti,Donald McCain,T G Leslie,6,0,150,0-4 over fences but each-way claims if resuming where he left off in January,"Point winner who is 0-7 under rules, with four of those defeats coming over fences; however, he was running well in January when last seen and holds each-way claims if resuming where he left off.",92,114,89,Theo Gillard,https://www.rp-assets.com/svg/7/0/4/169407.svg,288,49423-,36,"Cholmondeley, Cheshire",14,0,0,N/A,,6.5,,,,,,,,,,,7.4,,,,,,,,,,,,,,,,,,,,,,
Sedgefield,11/6/2025,14:30,Michael & Olivia Watson Novices' Handicap Chase (Go North Forgive 'n Forget Series Qual') (GBB),19.5,GB,Class 4,Chase,4yo+,0-110,"£4,700",9,Good,Turf,14 fences,FALSE,FALSE,,,"5/2 Fierce Warrior, 11/2 Groovy Blue,  Born In The West, 13/2 Whatyouwaitingfor, 15/2 Just Gino,  Eagles Gold, 8/1 Fat Harry, 14/1 Scots Poet, 16/1 Paramaribo",Paramaribo,hrs_22641920,7,gelding,b,IRE,Richard Milner (shropshire) Ltd,Homepage,Sea The Moon,Dansili,Victor Thompson,V Thompson,7,0,147,Won a point in March; makes chase debut in warm contest and may be best watched,"Flat and hurdle who has won two point-to-points, the latest this March; makes his chase/seasonal debut in what looks a warm contest and he may be best watched.",89,-,-,Miss Pippa Brown(7),https://www.rp-assets.com/svg/8/6/4/468.svg,551 (207P),5U213-,,"Alnwick, Northumbria",0,0,None,N/A,,26,101,,81,101,101,81,101,100,,,14,,,,,,,,,,,,,,,,,,,,,,
