course,date,off_time,race_name,distance_f,region,race_class,type,age_band,rating_band,prize,field_size,going,surface,jumps,big_race,is_abandoned,tip,verdict,betting_forecast,horse,horse_id,age,sex,colour,region_runner,breeder,dam,sire,damsire,trainer,owner,number,draw,lbs,comment,spotlight,ofr,rpr,ts,jockey,silk_url,last_run,form,trainer_rtf,trainer_location,trainer_14_runs,trainer_14_wins,trainer_14_percent,,,ORI,Best,Skybet,William Hill,Coral,Betfred,Boyle Sports,Ladbrokes,Betfair Exchange,RESULT,SP odd,BFOri,Jockey STAT,Race count,JOCKEY RACES,,,,,,,,,,,Trainer STAT,Race count,TRAINER RACES,,,,,,
Flemington,11/6/2025,18:10,Crown Oaks (Group 1) (3yo Fillies) (Turf),12.5,AUS,Class 1,Flat,3yo,,"£297,030",13,Soft,Turf,,FALSE,FALSE,,,"4/5 Getta Good Feeling, 8/1 The Pearls,  Spicy Lu,  Just A Journey, 9/1 Strictly Business, 14/1 Ethereum Girl, 20/1 After Summer,  Voting Rights,  Classic Gem, 25/1 Sheeza Diva, 50/1 Zouclaire, 100/1 Morisu Ojo,  Janey Bopper",Getta Good Feeling,hrs_52204845,3,filly,b,AUS,Phoenix Broodmare Farm,Marquise Da Rossa,So You Think,Testa Rossa,Danny O'Brien,Pinecliff Racing,1,4,123,,,-,132,-,Mark Zahra,https://www.rp-assets.com/svg/6/7/3/210376.svg,5,332131,,Australia,6,1,17,N/A,,,,,,,,,,,,,,Mark Zahra,1,18:10 | Flemington | Getta Good Feeling,,,,,,,,,,,Danny O'Brien,1,18:10 | Flemington | Getta Good Feeling,,,,,,
Flemington,11/6/2025,18:10,Crown Oaks (Group 1) (3yo Fillies) (Turf),12.5,AUS,Class 1,Flat,3yo,,"£297,030",13,Soft,Turf,,FALSE,FALSE,,,"4/5 Getta Good Feeling, 8/1 The Pearls,  Spicy Lu,  Just A Journey, 9/1 Strictly Business, 14/1 Ethereum Girl, 20/1 After Summer,  Voting Rights,  Classic Gem, 25/1 Sheeza Diva, 50/1 Zouclaire, 100/1 Morisu Ojo,  Janey Bopper",The Pearls,hrs_53081056,3,filly,ch,NZ,Ravelston Stud Ltd,The Pearler,Proisir,Volksraad,Chris Waller,China Horse Club,2,12,123,,,-,119,-,James McDonald,https://www.rp-assets.com/svg/3/4/8/215843.svg,12,534123,,Australia,66,11,17,N/A,,,,,,,,,,,,,,James McDonald,1,18:10 | Flemington | The Pearls,,,,,,,,,,,Chris Waller,1,18:10 | Flemington | The Pearls,,,,,,
Flemington,11/6/2025,18:10,Crown Oaks (Group 1) (3yo Fillies) (Turf),12.5,AUS,Class 1,Flat,3yo,,"£297,030",13,Soft,Turf,,FALSE,FALSE,,,"4/5 Getta Good Feeling, 8/1 The Pearls,  Spicy Lu,  Just A Journey, 9/1 Strictly Business, 14/1 Ethereum Girl, 20/1 After Summer,  Voting Rights,  Classic Gem, 25/1 Sheeza Diva, 50/1 Zouclaire, 100/1 Morisu Ojo,  Janey Bopper",Spicy Lu,hrs_52056326,3,filly,b,AUS,Esplin Family,All Salsa,Tagaloa,Charge Forward,Nick Olive,"N J Olive, N Gopaul Et Al",3,7,125,,,-,123,-,Nash Rawiller,https://www.rp-assets.com/svg/3/6/3/357363.svg,19,170481,,Australia,1,0,0,N/A,,,,,,,,,,,,,,Nash Rawiller,1,18:10 | Flemington | Spicy Lu,,,,,,,,,,,Nick Olive,1,18:10 | Flemington | Spicy Lu,,,,,,
Flemington,11/6/2025,18:10,Crown Oaks (Group 1) (3yo Fillies) (Turf),12.5,AUS,Class 1,Flat,3yo,,"£297,030",13,Soft,Turf,,FALSE,FALSE,,,"4/5 Getta Good Feeling, 8/1 The Pearls,  Spicy Lu,  Just A Journey, 9/1 Strictly Business, 14/1 Ethereum Girl, 20/1 After Summer,  Voting Rights,  Classic Gem, 25/1 Sheeza Diva, 50/1 Zouclaire, 100/1 Morisu Ojo,  Janey Bopper",Just A Journey,hrs_51523563,3,filly,b,AUS,Kia Ora Stud Pty Ltd,Caravan,Justify,Snitzel,Michael Freedman,"R McClure, Mrs B M McClure Et Al",4,10,123,,,-,120,-,Blake Shinn,https://www.rp-assets.com/svg/9/1/9/252919.svg,19,152122,,Australia,12,2,17,N/A,,,,,,,,,,,,,,Blake Shinn,1,18:10 | Flemington | Just A Journey,,,,,,,,,,,Michael Freedman,1,18:10 | Flemington | Just A Journey,,,,,,
Flemington,11/6/2025,18:10,Crown Oaks (Group 1) (3yo Fillies) (Turf),12.5,AUS,Class 1,Flat,3yo,,"£297,030",13,Soft,Turf,,FALSE,FALSE,,,"4/5 Getta Good Feeling, 8/1 The Pearls,  Spicy Lu,  Just A Journey, 9/1 Strictly Business, 14/1 Ethereum Girl, 20/1 After Summer,  Voting Rights,  Classic Gem, 25/1 Sheeza Diva, 50/1 Zouclaire, 100/1 Morisu Ojo,  Janey Bopper",Ethereum Girl,hrs_49078050,3,filly,br,AUS,Miss K Stephens,Moonchild,Maurice,Charge Forward,"Ben, Will & JD Hayes","M D Needham, D Tavoletti Et Al",5,3,123,,,-,126,-,Jamie Melham,https://www.rp-assets.com/svg/7/7/8/353877.svg,5,121486,,Australia,34,4,12,N/A,,,,,,,,,,,,,,Jamie Melham,1,18:10 | Flemington | Ethereum Girl,,,,,,,,,,,"Ben, Will & JD Hayes",1,18:10 | Flemington | Ethereum Girl,,,,,,
Flemington,11/6/2025,18:10,Crown Oaks (Group 1) (3yo Fillies) (Turf),12.5,AUS,Class 1,Flat,3yo,,"£297,030",13,Soft,Turf,,FALSE,FALSE,,,"4/5 Getta Good Feeling, 8/1 The Pearls,  Spicy Lu,  Just A Journey, 9/1 Strictly Business, 14/1 Ethereum Girl, 20/1 After Summer,  Voting Rights,  Classic Gem, 25/1 Sheeza Diva, 50/1 Zouclaire, 100/1 Morisu Ojo,  Janey Bopper",Sheeza Diva,hrs_48644379,3,filly,b/br,AUS,Wallings Bloodstock Pty Ltd,Dizzy Diva,Pierro,Starspangledbanner,Mitchell & Desiree Kearney,"Mrs D A Kearney, Ms L R Pejic Et Al",6,11,123,,,-,115,-,Rachel King,https://www.rp-assets.com/svg/1/0/5/353501.svg,12,061348,,Australia,1,0,0,N/A,,,,,,,,,,,,,,Rachel King,1,18:10 | Flemington | Sheeza Diva,,,,,,,,,,,Mitchell & Desiree Kearney,1,18:10 | Flemington | Sheeza Diva,,,,,,
Flemington,11/6/2025,18:10,Crown Oaks (Group 1) (3yo Fillies) (Turf),12.5,AUS,Class 1,Flat,3yo,,"£297,030",13,Soft,Turf,,FALSE,FALSE,,,"4/5 Getta Good Feeling, 8/1 The Pearls,  Spicy Lu,  Just A Journey, 9/1 Strictly Business, 14/1 Ethereum Girl, 20/1 After Summer,  Voting Rights,  Classic Gem, 25/1 Sheeza Diva, 50/1 Zouclaire, 100/1 Morisu Ojo,  Janey Bopper",Strictly Business,hrs_58132928,3,filly,br,AUS,M Falvey,Tivoli Lass,Grunt,Uncle Mo,Thomas D Carberry,"Mhumhain Racing Syndicate, D Insall Et Al",7,13,123,,,-,124,-,John Allen,https://www.rp-assets.com/svg/6/4/6/363646.svg,5,712,,Australia,2,1,50,N/A,,,,,,,,,,,,,,John Allen,1,18:10 | Flemington | Strictly Business,,,,,,,,,,,Thomas D Carberry,1,18:10 | Flemington | Strictly Business,,,,,,
Flemington,11/6/2025,18:10,Crown Oaks (Group 1) (3yo Fillies) (Turf),12.5,AUS,Class 1,Flat,3yo,,"£297,030",13,Soft,Turf,,FALSE,FALSE,,,"4/5 Getta Good Feeling, 8/1 The Pearls,  Spicy Lu,  Just A Journey, 9/1 Strictly Business, 14/1 Ethereum Girl, 20/1 After Summer,  Voting Rights,  Classic Gem, 25/1 Sheeza Diva, 50/1 Zouclaire, 100/1 Morisu Ojo,  Janey Bopper",After Summer,hrs_58033339,3,filly,ch,AUS,Arrowfield Group Pty Ltd,Al Jasrah,The Autumn Sun,Shirocco,Dominic Sutton,"Sutton Racing Pty Ltd, S Chappell Et Al",8,2,123,,,-,119,-,Billy Egan,https://www.rp-assets.com/svg/1/6/0/346061.svg,19,4713,,Australia,3,0,0,N/A,,,,,,,,,,,,,,Billy Egan,1,18:10 | Flemington | After Summer,,,,,,,,,,,Dominic Sutton,1,18:10 | Flemington | After Summer,,,,,,
Flemington,11/6/2025,18:10,Crown Oaks (Group 1) (3yo Fillies) (Turf),12.5,AUS,Class 1,Flat,3yo,,"£297,030",13,Soft,Turf,,FALSE,FALSE,,,"4/5 Getta Good Feeling, 8/1 The Pearls,  Spicy Lu,  Just A Journey, 9/1 Strictly Business, 14/1 Ethereum Girl, 20/1 After Summer,  Voting Rights,  Classic Gem, 25/1 Sheeza Diva, 50/1 Zouclaire, 100/1 Morisu Ojo,  Janey Bopper",Zouclaire,hrs_48644302,3,filly,br,AUS,Kulani Park Pty Ltd,Dame Claire,Zousain,Danehill Dancer,Ciaron Maher,"Bennett Racing Syndicate, Kavascat Syndicate Et Al",9,1,123,,,-,111,-,Ethan Brown,https://www.rp-assets.com/svg/4/9/4/353494.svg,19,-78245,,Australia,48,9,19,N/A,,,,,,,,,,,,,,Ethan Brown,1,18:10 | Flemington | Zouclaire,,,,,,,,,,,Ciaron Maher,2,18:10 | Flemington | Zouclaire,18:10 | Flemington | Morisu Ojo,,,,,
Flemington,11/6/2025,18:10,Crown Oaks (Group 1) (3yo Fillies) (Turf),12.5,AUS,Class 1,Flat,3yo,,"£297,030",13,Soft,Turf,,FALSE,FALSE,,,"4/5 Getta Good Feeling, 8/1 The Pearls,  Spicy Lu,  Just A Journey, 9/1 Strictly Business, 14/1 Ethereum Girl, 20/1 After Summer,  Voting Rights,  Classic Gem, 25/1 Sheeza Diva, 50/1 Zouclaire, 100/1 Morisu Ojo,  Janey Bopper",Voting Rights,hrs_45950338,3,filly,b,AUS,G S A Bloodstock Pty Ltd,Susan B Anthony,Snitzel,Galileo,Gai Waterhouse & Adrian Bott,Pinecliff Racing,10,5,123,,,-,121,-,Jordan Childs,https://www.rp-assets.com/svg/6/7/3/210376.svg,5,93713,,Australia,15,2,13,N/A,,,,,,,,,,,,,,Jordan Childs,1,18:10 | Flemington | Voting Rights,,,,,,,,,,,Gai Waterhouse & Adrian Bott,1,18:10 | Flemington | Voting Rights,,,,,,
Flemington,11/6/2025,18:10,Crown Oaks (Group 1) (3yo Fillies) (Turf),12.5,AUS,Class 1,Flat,3yo,,"£297,030",13,Soft,Turf,,FALSE,FALSE,,,"4/5 Getta Good Feeling, 8/1 The Pearls,  Spicy Lu,  Just A Journey, 9/1 Strictly Business, 14/1 Ethereum Girl, 20/1 After Summer,  Voting Rights,  Classic Gem, 25/1 Sheeza Diva, 50/1 Zouclaire, 100/1 Morisu Ojo,  Janey Bopper",Morisu Ojo,hrs_54811701,3,filly,b,AUS,I K Smith,Fill The Page,Maurice,Dane Shadow,Ciaron Maher,"Ciaron Maher Racing, High Calibre Racing Et Al",11,8,123,,,-,110,-,Craig A Williams,https://www.rp-assets.com/svg/0/7/0/360070.svg,19,445168,,Australia,48,9,19,N/A,,,,,,,,,,,,,,Craig A Williams,1,18:10 | Flemington | Morisu Ojo,,,,,,,,,,,Wendy Kelly,1,18:10 | Flemington | Classic Gem,,,,,,
Flemington,11/6/2025,18:10,Crown Oaks (Group 1) (3yo Fillies) (Turf),12.5,AUS,Class 1,Flat,3yo,,"£297,030",13,Soft,Turf,,FALSE,FALSE,,,"4/5 Getta Good Feeling, 8/1 The Pearls,  Spicy Lu,  Just A Journey, 9/1 Strictly Business, 14/1 Ethereum Girl, 20/1 After Summer,  Voting Rights,  Classic Gem, 25/1 Sheeza Diva, 50/1 Zouclaire, 100/1 Morisu Ojo,  Janey Bopper",Classic Gem,hrs_55061258,3,filly,br/bl,AUS,Noorilim Park Thoroughbreds,Lankan Gold,Maurice,Dundeel,Wendy Kelly,K J Payne & Mrs V M Payne,12,9,123,,,-,118,-,Ben Allen,https://www.rp-assets.com/svg/1/6/8/213861.svg,19,52534,,Australia,0,0,None,N/A,,,,,,,,,,,,,,Ben Allen,1,18:10 | Flemington | Classic Gem,,,,,,,,,,,Andrew Bobbin,1,18:10 | Flemington | Janey Bopper,,,,,,
Flemington,11/6/2025,18:10,Crown Oaks (Group 1) (3yo Fillies) (Turf),12.5,AUS,Class 1,Flat,3yo,,"£297,030",13,Soft,Turf,,FALSE,FALSE,,,"4/5 Getta Good Feeling, 8/1 The Pearls,  Spicy Lu,  Just A Journey, 9/1 Strictly Business, 14/1 Ethereum Girl, 20/1 After Summer,  Voting Rights,  Classic Gem, 25/1 Sheeza Diva, 50/1 Zouclaire, 100/1 Morisu Ojo,  Janey Bopper",Janey Bopper,hrs_58504285,3,filly,b,AUS,D Kerr,Jane's Angel,Finn McCool,Smart Missile,Andrew Bobbin,"R P McDonald, D P Kerr & A R Bobbin",13,6,123,,,-,-,-,Harry Coffey,https://www.rp-assets.com/svg/0/3/2/364230.svg,,863,,Australia,3,0,0,N/A,,,,,,,,,,,,,,Harry Coffey,1,18:10 | Flemington | Janey Bopper,,,,,,,,,,,William Muir & Chris Grassick,2,16:45 | Chelmsford (AW) | Captain Cairney,19:15 | Chelmsford (AW) | Starproof,,,,,
Chelmsford (AW),11/6/2025,16:45,Flutter Proudly Supporting Pancreatic Cancer UK Nursery Handicap,10,GB,Class 6,Flat,2yo,0-60,"£3,664",6,Standard,AW,,FALSE,FALSE,Captain Cairney,The safest play is CAPTAIN CAIRNEY (nap) who made all for a comfortable success over C&D with two of these behind.,"11/10 Captain Cairney, 5/2 Time For Action, 5/1 Onyeisi, 7/1 Lexington Express, 16/1 El Carrusel, 20/1 Sporty Socks",Captain Cairney,hrs_56127673,2,colt,ch,GB,The National Stud,Cardiff,Sottsass,Dubawi,William Muir & Chris Grassick,J O'Mulloy And W R Muir,1,1,135,Had the run of things up front but still won well over C&D two weeks ago; 4lb higher,Had the run of things up front but still won well over C&D two weeks ago with two of these behind; solid chance off 4lb higher.,59,63,39,Lewis Edmunds,https://www.rp-assets.com/svg/7/4/2/306247.svg,14,686531,46,"Lambourn, Berks",13,2,15,N/A,,2,1.73,,1.67,1.73,1.73,1.73,1.73,1.74,,,2.06,Lewis Edmunds,3,16:45 | Chelmsford (AW) | Captain Cairney,18:45 | Chelmsford (AW) | Freddie's Star,19:15 | Chelmsford (AW) | Starproof,,,,,,,,,Alice Haynes,2,16:45 | Chelmsford (AW) | Lexington Express,20:15 | Chelmsford (AW) | Maywedance,,,,,
Chelmsford (AW),11/6/2025,16:45,Flutter Proudly Supporting Pancreatic Cancer UK Nursery Handicap,10,GB,Class 6,Flat,2yo,0-60,"£3,664",6,Standard,AW,,FALSE,FALSE,Captain Cairney,The safest play is CAPTAIN CAIRNEY (nap) who made all for a comfortable success over C&D with two of these behind.,"11/10 Captain Cairney, 5/2 Time For Action, 5/1 Onyeisi, 7/1 Lexington Express, 16/1 El Carrusel, 20/1 Sporty Socks",Lexington Express,hrs_52451973,2,filly,b,IRE,Philip & Orla Hore,Bean Uasal,Prince Of Lir,Oasis Dream,Alice Haynes,Middleham Park Racing LXI,2,4,134,Beaten in five nurseries and yet has only dropped 4lb for her troubles; unraced beyond 1m,Beaten in five nurseries and yet has only dropped 4lb for her troubles; unraced beyond 1m and wouldn't be certain to stay this far.,58,61,-,Kieran O'Neill,https://www.rp-assets.com/svg/6/1/9/189916.svg,31,534534,38,"Newmarket, Suffolk",21,1,5,N/A,,8,8.5,,8.5,8.5,8,8.5,8.5,9.6,,,8.8,Kieran O'Neill,2,16:45 | Chelmsford (AW) | Lexington Express,20:15 | Chelmsford (AW) | Maywedance,,,,,,,,,,Charlie Johnston,2,16:45 | Chelmsford (AW) | Onyeisi,14:10 | Newcastle (AW) | Parisian Scholar,,,,,
Chelmsford (AW),11/6/2025,16:45,Flutter Proudly Supporting Pancreatic Cancer UK Nursery Handicap,10,GB,Class 6,Flat,2yo,0-60,"£3,664",6,Standard,AW,,FALSE,FALSE,Captain Cairney,The safest play is CAPTAIN CAIRNEY (nap) who made all for a comfortable success over C&D with two of these behind.,"11/10 Captain Cairney, 5/2 Time For Action, 5/1 Onyeisi, 7/1 Lexington Express, 16/1 El Carrusel, 20/1 Sporty Socks",Onyeisi,hrs_53211620,2,colt,b,GB,Alan Spence,Fire Dancing,Profitable,Iffraaj,Charlie Johnston,A D Spence & I Madueke,3,2,133,Poor so far and all depends on whether the blinkers will trigger something,No closer than 6l in his first three races and beaten 20l on recent nursery debut (1m); all depends on whether the blinkers will trigger something.,57,61,36,Rossa Ryan,https://www.rp-assets.com/svg/b/4/8/352384b.svg,5,7546,48,"Middleham Moor, N Yorks",33,3,9,N/A,,7,8.5,,8.5,8.5,8.5,8.5,8.5,9.4,,,6,Rossa Ryan,7,16:45 | Chelmsford (AW) | Onyeisi,17:15 | Chelmsford (AW) | Madman,17:45 | Chelmsford (AW) | Starlight Time,18:15 | Chelmsford (AW) | Absolute Star,19:15 | Chelmsford (AW) | Rogue Allegiance,19:45 | Chelmsford (AW) | Spendmore Lane,20:15 | Chelmsford (AW) | Bintazzo,,,,,David Flood,1,16:45 | Chelmsford (AW) | Time For Action,,,,,,
Chelmsford (AW),11/6/2025,16:45,Flutter Proudly Supporting Pancreatic Cancer UK Nursery Handicap,10,GB,Class 6,Flat,2yo,0-60,"£3,664",6,Standard,AW,,FALSE,FALSE,Captain Cairney,The safest play is CAPTAIN CAIRNEY (nap) who made all for a comfortable success over C&D with two of these behind.,"11/10 Captain Cairney, 5/2 Time For Action, 5/1 Onyeisi, 7/1 Lexington Express, 16/1 El Carrusel, 20/1 Sporty Socks",Time For Action,hrs_55030115,2,filly,b,GB,Fernham Farm Ltd,Life Is Golden,Time Test,Giant's Causeway,David Flood,Ms L Howard,4,3,133,"Second and first in her two nurseries at Bath (1m, soft), dominating throughout last week","Second and first in her two nurseries at Bath (1m, soft), dominating throughout last week for a clearcut win; solid chance under a penalty with Jack Dace again up top; gives the impression she'll stay this far.",57,62,31,Jack Dace(5),https://www.rp-assets.com/svg/9/6/2/360269.svg,7,77921,100,"Stow-On-The-Wold, Gloucs",1,1,100,N/A,,3.75,6.5,,6.5,6,6,6,6,7.4,,,4.6,Jack Dace(5),2,16:45 | Chelmsford (AW) | Time For Action,19:15 | Chelmsford (AW) | Lipsink,,,,,,,,,,John Ryan,2,16:45 | Chelmsford (AW) | El Carrusel,17:00 | Newcastle (AW) | Sturlasson,,,,,
Chelmsford (AW),11/6/2025,16:45,Flutter Proudly Supporting Pancreatic Cancer UK Nursery Handicap,10,GB,Class 6,Flat,2yo,0-60,"£3,664",6,Standard,AW,,FALSE,FALSE,Captain Cairney,The safest play is CAPTAIN CAIRNEY (nap) who made all for a comfortable success over C&D with two of these behind.,"11/10 Captain Cairney, 5/2 Time For Action, 5/1 Onyeisi, 7/1 Lexington Express, 16/1 El Carrusel, 20/1 Sporty Socks",El Carrusel,hrs_55634117,2,gelding,b,GB,Genesis Green Stud Ltd,Smitten,Advertise,New Approach,John Ryan,The Boys Are Back In Town,5,5,127,Second in a modest Yarmouth nursery in September but has trailed home last since then,"Second in a modest Yarmouth nursery in September but has trailed home last since then, latterly in Captain Cairney's race here (22-1; tried cheekpieces).",51,60,14,Darragh Keenan,https://www.rp-assets.com/svg/8/5/7/360758.svg,14,647247,33,"Newmarket, Suffolk",7,0,0,N/A,,23,51,,51,51,41,51,51,36,,,12,Darragh Keenan,5,16:45 | Chelmsford (AW) | El Carrusel,18:15 | Chelmsford (AW) | Stenmark,19:15 | Chelmsford (AW) | Counsel,19:45 | Chelmsford (AW) | Mick's Spirit,20:15 | Chelmsford (AW) | Holly Holy,,,,,,,William Stone,1,16:45 | Chelmsford (AW) | Sporty Socks,,,,,,
Chelmsford (AW),11/6/2025,16:45,Flutter Proudly Supporting Pancreatic Cancer UK Nursery Handicap,10,GB,Class 6,Flat,2yo,0-60,"£3,664",6,Standard,AW,,FALSE,FALSE,Captain Cairney,The safest play is CAPTAIN CAIRNEY (nap) who made all for a comfortable success over C&D with two of these behind.,"11/10 Captain Cairney, 5/2 Time For Action, 5/1 Onyeisi, 7/1 Lexington Express, 16/1 El Carrusel, 20/1 Sporty Socks",Sporty Socks,hrs_52742172,2,filly,b,GB,Dr Caroline Scott,The Jean Genie,Iffraaj,Lawman,William Stone,Miss Caroline Scott,6,6,125,Behind Captain Cairney here last time; the hood needs to make a difference,"No match for the winner when second in her first handicap and hasn't progressed from there, last time finishing behind Captain Cairney here; the hood needs to make a difference.",49,61,60,Alistair Rawlinson,https://www.rp-assets.com/svg/5/8/3/127385.svg,14,775265,40,"West Wickham, Cambs",6,1,17,N/A,,11,9.5,,9.5,9.5,9,9,9.5,9.8,,,11,Alistair Rawlinson,2,16:45 | Chelmsford (AW) | Sporty Socks,18:45 | Chelmsford (AW) | Rory's Royale,,,,,,,,,,Richard Hannon,1,17:15 | Chelmsford (AW) | Corniche Girl,,,,,,
Chelmsford (AW),11/6/2025,17:15,Betfair Racing Podcasts Nursery Handicap,6,GB,Class 6,Flat,2yo,0-65,"£3,664",8,Standard,AW,,FALSE,FALSE,Beach Partee,The solid one here is BEACH PARTEE who is taken to defy the handicapper again and make it two wins in his last three starts.,"11/4 Beach Partee, 7/2 Ladiapur, 11/2 Corniche Girl, 6/1 Solar Invincible,  Madman, 8/1 Flash Rascal, 14/1 Sail On Sailor,  Barry The Worm",Corniche Girl,hrs_51736097,2,filly,b,IRE,Joe Fogarty,Sweeproad,Dandy Man,No Nay Never,Richard Hannon,"C Munro, Mrs M Gander And Partner",1,8,135,Form of 6f Kempton win in August boosted but found it tougher off higher marks since,Won 6f Kempton 0-65 in August; had a subsequent back-to-back winner behind in second on that occasion but she's struggled off higher marks on both outings since; is at least back in a 0-65 now and Alec Voikhansky takes 3lb off.,65,68,45,Alec Voikhansky(3),https://www.rp-assets.com/svg/9/8/2/348289.svg,23,405179,61,"Herridge, Wilts",31,5,16,N/A,,5,5.5,,5.5,5.5,5,5.5,5.5,5.7,,,4.8,Alec Voikhansky(3),1,17:15 | Chelmsford (AW) | Corniche Girl,,,,,,,,,,,Dr Richard Newland & Jamie Insole,3,17:15 | Chelmsford (AW) | Flash Rascal,14:37 | Ludlow | Lady Kara,13:20 | Sedgefield | Get A Superstar,,,,
Chelmsford (AW),11/6/2025,17:15,Betfair Racing Podcasts Nursery Handicap,6,GB,Class 6,Flat,2yo,0-65,"£3,664",8,Standard,AW,,FALSE,FALSE,Beach Partee,The solid one here is BEACH PARTEE who is taken to defy the handicapper again and make it two wins in his last three starts.,"11/4 Beach Partee, 7/2 Ladiapur, 11/2 Corniche Girl, 6/1 Solar Invincible,  Madman, 8/1 Flash Rascal, 14/1 Sail On Sailor,  Barry The Worm",Flash Rascal,hrs_52742200,2,gelding,b,GB,Miss P Briselden,Delirium,Havana Grey,Tamayuz,Dr Richard Newland & Jamie Insole,Jimbo & Simmo,2,5,135,2l fourth on 6f nursery debut and possibly failed to cope with heavy at Nottingham since,"Positive return from gelding/wind operations when 2l fourth on his nursery debut at Yarmouth (6f, good) last month; possible he simply failed to cope with very testing ground when down the field at Nottingham since; AW debut.",65,66,-,Marco Ghiani,https://www.rp-assets.com/svg/1/0/2/358201.svg,14,74640,39,"Elmbridge, Worcs",29,1,3,N/A,,9.5,8,,8,8,7,8,8,8,,,10,Marco Ghiani,3,17:15 | Chelmsford (AW) | Flash Rascal,17:45 | Chelmsford (AW) | Devil's Brigade,19:45 | Chelmsford (AW) | General Assembly,,,,,,,,,Charlie Fellowes,1,17:15 | Chelmsford (AW) | Ladiapur,,,,,,
Chelmsford (AW),11/6/2025,17:15,Betfair Racing Podcasts Nursery Handicap,6,GB,Class 6,Flat,2yo,0-65,"£3,664",8,Standard,AW,,FALSE,FALSE,Beach Partee,The solid one here is BEACH PARTEE who is taken to defy the handicapper again and make it two wins in his last three starts.,"11/4 Beach Partee, 7/2 Ladiapur, 11/2 Corniche Girl, 6/1 Solar Invincible,  Madman, 8/1 Flash Rascal, 14/1 Sail On Sailor,  Barry The Worm",Ladiapur,hrs_53539479,2,filly,b,GB,Lady Bamford & The Hon Alice Bamford,The Wagon Wheel,Showcasing,Acclamation,Charlie Fellowes,Lady Bamford & Alice Bamford,3,6,134,Only modest form in three 6f starts but useful pedigree and may do better in nurseries,"Only modest form in three qualifying runs over 6f (here latest), but she went off a single-figure price on a couple of occasions and is certainly bred to be better than an opening mark in the mid-60s.",64,62,42,Kieran Shoemark,https://www.rp-assets.com/svg/8/0/1/130108.svg,35,564,42,"Newmarket, Suffolk",12,0,0,N/A,,6,6.5,,6.5,6.5,6,5.5,6.5,7.4,,,6.2,Kieran Shoemark,5,17:15 | Chelmsford (AW) | Ladiapur,17:45 | Chelmsford (AW) | Spirit Of Athene,18:15 | Chelmsford (AW) | Happy Banner,19:15 | Chelmsford (AW) | Diamond Dreamer,20:15 | Chelmsford (AW) | Salaria,,,,,,,William Knight,4,17:15 | Chelmsford (AW) | Beach Partee,17:45 | Chelmsford (AW) | Timely Salute,20:15 | Chelmsford (AW) | Le Pelerin,14:45 | Newcastle (AW) | Athenian Spirit,,,
Chelmsford (AW),11/6/2025,17:15,Betfair Racing Podcasts Nursery Handicap,6,GB,Class 6,Flat,2yo,0-65,"£3,664",8,Standard,AW,,FALSE,FALSE,Beach Partee,The solid one here is BEACH PARTEE who is taken to defy the handicapper again and make it two wins in his last three starts.,"11/4 Beach Partee, 7/2 Ladiapur, 11/2 Corniche Girl, 6/1 Solar Invincible,  Madman, 8/1 Flash Rascal, 14/1 Sail On Sailor,  Barry The Worm",Beach Partee,hrs_49141645,2,gelding,ch,GB,Chasemore Farm,Parsnip,Lope Y Fernandez,Zebedee,William Knight,John & Peter Seabrook And Tim Fisher,4,1,133,"Now 2-3 since cheekpieces fitted, seeing off next-time-out winner over 5f here latest","Improved since fitted with cheekpieces, making it two wins in his last three starts when seeing off a next-time-out winner over 5f here six weeks ago; will be at least as effective back at 6f and a 6lb rise shouldn't prevent a bold bid from the inside stall.",63,66,61,Luke Morris,https://www.rp-assets.com/svg/5/1/8/351815.svg,21,364141,38,"Newmarket, Suffolk",8,0,0,N/A,,4,5.5,,5.5,5.5,5.5,5.5,5.5,5.7,,,3.95,Luke Morris,6,17:15 | Chelmsford (AW) | Beach Partee,17:45 | Chelmsford (AW) | Timely Salute,18:15 | Chelmsford (AW) | Threatening,19:15 | Chelmsford (AW) | Giant,19:45 | Chelmsford (AW) | Desdemona,20:15 | Chelmsford (AW) | Coolree,,,,,,Roger Teal,2,17:15 | Chelmsford (AW) | Solar Invincible,18:45 | Chelmsford (AW) | Freddie's Star,,,,,
Chelmsford (AW),11/6/2025,17:15,Betfair Racing Podcasts Nursery Handicap,6,GB,Class 6,Flat,2yo,0-65,"£3,664",8,Standard,AW,,FALSE,FALSE,Beach Partee,The solid one here is BEACH PARTEE who is taken to defy the handicapper again and make it two wins in his last three starts.,"11/4 Beach Partee, 7/2 Ladiapur, 11/2 Corniche Girl, 6/1 Solar Invincible,  Madman, 8/1 Flash Rascal, 14/1 Sail On Sailor,  Barry The Worm",Solar Invincible,hrs_55882330,2,gelding,b,IRE,Yeomanstown Stud,Masaya,Invincible Army,Dansili,Roger Teal,James Dellaway,5,4,130,Promise first three runs; wide trip possible excuse on recent nursery debut; could go well,Improved his RPR with each of his three maiden/novice runs; that trend didn't continue on last month's 6f Kempton nursery but a wide trip didn't help and he's 7lb lower here if Jack Callan's 5lb claim is taken into account; could bounce back.,60,67,35,Jack Callan(5),https://www.rp-assets.com/svg/1/6/9/341961.svg,15,4647,47,"Lambourn, Berks",16,0,0,N/A,,6.5,4,,4,4,4,3.75,4,4.3,,,6.6,Jack Callan(5),3,17:15 | Chelmsford (AW) | Solar Invincible,18:15 | Chelmsford (AW) | Port Erin,20:15 | Chelmsford (AW) | Dark Lyric,,,,,,,,,Brett Johnson,1,17:15 | Chelmsford (AW) | Sail On Sailor,,,,,,
Chelmsford (AW),11/6/2025,17:15,Betfair Racing Podcasts Nursery Handicap,6,GB,Class 6,Flat,2yo,0-65,"£3,664",8,Standard,AW,,FALSE,FALSE,Beach Partee,The solid one here is BEACH PARTEE who is taken to defy the handicapper again and make it two wins in his last three starts.,"11/4 Beach Partee, 7/2 Ladiapur, 11/2 Corniche Girl, 6/1 Solar Invincible,  Madman, 8/1 Flash Rascal, 14/1 Sail On Sailor,  Barry The Worm",Sail On Sailor,hrs_55700834,2,gelding,b,GB,Throckmorton Court Stud Ltd,Mumtaza,Eqtidaar,Nayef,Brett Johnson,The Switchback Partnership,6,7,129,Minor ability in three runs over 7f; has raced keenly and drop to 6f may help,Minor ability in three outings over 7f; quite a keen goer and possible this drop to 6f could suit now handicapping; worth a precautionary betting check.,59,66,50,Paddy Bradley,https://www.rp-assets.com/svg/3/5/4/357453.svg,29,649,100,"Epsom, Surrey",1,0,0,N/A,,17,29,,29,29,26,29,29,32,,,21,Paddy Bradley,3,17:15 | Chelmsford (AW) | Sail On Sailor,18:15 | Chelmsford (AW) | Pitney,20:15 | Chelmsford (AW) | Huxley,,,,,,,,,Edward Smyth-Osbourne,2,17:15 | Chelmsford (AW) | Barry The Worm,18:15 | Chelmsford (AW) | War Chant,,,,,
